{
  "specversion": "1.0",
  "id": "00000010-0000-4000-8000-000000000010",
  "type": "transcript.final",
  "source": "halo/golden",
  "time": "2026-10-31T09:00:00Z",
  "meetingid": "22222222-2222-4222-8222-222222222222",
  "datacontenttype": "application/json",
  "data": {
    "turn_id": "00000030-0000-4000-8000-000000000030",
    "stream": "tab",
    "speaker": "A",
    "text": "Launch moves to Nov 12.",
    "lang": "mixed",
    "ts_start_ms": 1760000001000,
    "ts_end_ms": 1760000004000
  }
}
