{
  "specversion": "1.0",
  "id": "00000007-0000-4000-8000-000000000007",
  "type": "meeting.context",
  "source": "halo/golden",
  "time": "2026-10-31T09:00:00Z",
  "meetingid": "22222222-2222-4222-8222-222222222222",
  "datacontenttype": "application/json",
  "data": {
    "subject": "Launch readiness",
    "agenda": [
      "Pricing",
      "RTL"
    ],
    "roles": [
      {
        "name": "Layla",
        "role": "Engineering lead"
      },
      {
        "name": "Omar"
      }
    ],
    "viewer_lang": "en",
    "project_id": "halo-q4"
  }
}
