{
  "specversion": "1.0",
  "id": "00000015-0000-4000-8000-000000000015",
  "type": "tags.set",
  "source": "halo/golden",
  "time": "2026-10-31T09:00:00Z",
  "meetingid": "22222222-2222-4222-8222-222222222222",
  "datacontenttype": "application/json",
  "data": {
    "target": "point",
    "target_id": "00000040-0000-4000-8000-000000000040",
    "urgency": "urgent",
    "source": "user"
  }
}
