{
  "specversion": "1.0",
  "id": "00000012-0000-4000-8000-000000000012",
  "type": "speaker.mapped",
  "source": "halo/golden",
  "time": "2026-10-31T09:00:00Z",
  "meetingid": "22222222-2222-4222-8222-222222222222",
  "datacontenttype": "application/json",
  "data": {
    "speaker": "A",
    "tile_id": "spaces/x/devices/1",
    "name": "Layla",
    "locked": true,
    "corrects": [
      "00000031-0000-4000-8000-000000000031"
    ]
  }
}
