{
  "specversion": "1.0",
  "id": "00000016-0000-4000-8000-000000000016",
  "type": "notes.ready",
  "source": "halo/golden",
  "time": "2026-10-31T09:00:00Z",
  "meetingid": "22222222-2222-4222-8222-222222222222",
  "datacontenttype": "application/json",
  "data": {
    "meeting_id": "22222222-2222-4222-8222-222222222222",
    "project_id": "halo-q4",
    "url": "/notes/22222222-2222-4222-8222-222222222222",
    "degraded": false,
    "people": [
      {
        "name": "Layla",
        "role": "Engineering lead",
        "why": "Owns RTL.",
        "relevant_points": [
          "00000040-0000-4000-8000-000000000040"
        ],
        "own_points": [],
        "actions": [
          {
            "action_id": "00000050-0000-4000-8000-000000000050",
            "text": "Share mockups",
            "owner": "Layla",
            "status": "assigned",
            "urgency": "urgent"
          }
        ]
      }
    ]
  }
}
