{
  "specversion": "1.0",
  "id": "00000013-0000-4000-8000-000000000013",
  "type": "points.upsert",
  "source": "halo/golden",
  "time": "2026-10-31T09:00:00Z",
  "meetingid": "22222222-2222-4222-8222-222222222222",
  "datacontenttype": "application/json",
  "data": {
    "point_id": "00000040-0000-4000-8000-000000000040",
    "tile_id": "spaces/x/devices/1",
    "speaker_name": "Layla",
    "kind": "decision",
    "text": "Launch moves to Nov 12",
    "lang": "en",
    "quote": "Launch moves to Nov 12.",
    "turn_ids": [
      "00000030-0000-4000-8000-000000000030"
    ],
    "rank": 1,
    "attribution": "locked",
    "urgency": "medium",
    "is_action": true,
    "engine": "spark-open"
  }
}
